<?xml version="1.0" encoding="UTF-8"?>
  <pedidos xmlns:xsi="http://www.w3.org/2001/XMLSchema-instance" xsi:noNamespaceSchemaLocation="casoFinal03.xsd">
    <pedido>
      <empresa CIF="1000"/>
      <producto>Máquina de coser</producto>
      <fecha>23/08/2003</fecha>
      <factura numFactura="F1" cliente_factura="E45">
        <emisor>Empresa S.A</emisor>
        <total>2000</total>
        <fechaFactura>30/08/2003</fechaFactura>
      </factura>
    </pedido>
    <pedido>
      <cliente NIF="C1">
        <MOTE>Juan</MOTE>
      </cliente>
      <producto>Romba</producto>
      <fecha>10/01/2015</fecha>
      <factura numFactura="F2">
        <emisor>Empresa S.A</emisor>
        <total>1500</total>
        <fechaFactura>20/01/2015</fechaFactura>
      </factura>
    </pedido>
  </pedidos>